{"checks":[{"description":"Every demand node has exactly R candidate out-arcs","id":"arcs_per_demand_node","result":"PASS","value":true},{"description":"No duplicate (site, demand) out-arc","id":"arcs_unique","result":"PASS","value":true},{"description":"Total candidate capacity / total weighted demand","id":"capacity_covers_demand","result":"PASS","value":2.4},{"description":"Total plant supply / total demand per commodity (min)","id":"supply_covers_demand","result":"PASS","value":1.25},{"description":"Demand nodes, sites and plants reference real GEOIDs; sites are distinct","id":"distinct_places","result":"PASS","value":true},{"description":"All road-equivalent distances are non-negative (a plant may share a host city with a site: distance 0)","id":"nonnegative_distances","result":"PASS","value":true},{"description":"Joined rows = PEP SUMLEV 162 rows - unmatched PEP rows","id":"gaz_pep_balance","result":"PASS","value":true},{"description":"Demand-node population sum (OBSERVED)","id":"population_sum","result":"PASS","value":63801512}],"generated_at":"2026-10-11T04:03:21Z","join_ledger":{"active_joined":19460,"dropped_non_contiguous":149,"dropped_not_active_either_file":20,"dropped_zero_pop":3,"gazetteer_rows":32363,"gazetteer_unmatched_by_funcstat":{"A":8,"I":32,"N":1,"S":12842},"gazetteer_unmatched_to_pep":12883,"joined":19480,"pep_geoid_unique":19483,"pep_rows_all_sumlev":81353,"pep_sumlev162_rows":19483,"pep_unmatched_to_gazetteer":3,"usable_places":19308,"usable_population_sum":211071042},"schema_version":"v1","selection":{"demand_nodes":100,"demand_population":63801512,"excluded_states":["AK","HI","PR"],"internal_point_note":"Coordinates are Census internal points inside each place boundary: not city halls, not population centroids, not warehouse locations.","share_of_usable_population":0.3023},"tags":{"checks":"DERIVED","join_ledger":"OBSERVED","selection":"DERIVED"}}
